[
  {
    "id": "sc_text_mv_alibaba__qwen3.8-27b_default_2026-10-22",
    "modelVersionId": "mv_alibaba__qwen3.8-27b",
    "source": "arena_hf",
    "board": "text",
    "condition": "default",
    "rating": 1439.9476000757259,
    "ciLow": 1435.0630328618918,
    "ciHigh": 1444.8321672895604,
    "rank": 76,
    "votes": 26238,
    "snapshotDate": "2026-10-22",
    "sourceRef": "arena_hf:text:Qwen3.8-27B:2026-10-22"
  },
  {
    "id": "sc_webdev_mv_alibaba__qwen3.8-27b_default_2026-10-23",
    "modelVersionId": "mv_alibaba__qwen3.8-27b",
    "source": "arena_hf",
    "board": "webdev",
    "condition": "default",
    "rating": 1591.365758281203,
    "ciLow": 1584.9407069629287,
    "ciHigh": 1597.7908095994771,
    "rank": 32,
    "votes": 17186,
    "snapshotDate": "2026-10-23",
    "sourceRef": "arena_hf:webdev:Qwen3.8-27B:2026-10-23"
  },
  {
    "id": "sc_text_mv_alibaba__qwen3.8-max_default_2026-10-22",
    "modelVersionId": "mv_alibaba__qwen3.8-max",
    "source": "arena_hf",
    "board": "text",
    "condition": "default",
    "rating": 1483.5957731582403,
    "ciLow": 1478.782962554455,
    "ciHigh": 1488.408583762026,
    "rank": 15,
    "votes": 30500,
    "snapshotDate": "2026-10-22",
    "sourceRef": "arena_hf:text:Qwen3.8-Max:2026-10-22"
  },
  {
    "id": "sc_webdev_mv_alibaba__qwen3.8-max_default_2026-10-23",
    "modelVersionId": "mv_alibaba__qwen3.8-max",
    "source": "arena_hf",
    "board": "webdev",
    "condition": "default",
    "rating": 1672.2475991725692,
    "ciLow": 1660.1904394504381,
    "ciHigh": 1684.3047588947002,
    "rank": 13,
    "votes": 3429,
    "snapshotDate": "2026-10-23",
    "sourceRef": "arena_hf:webdev:Qwen3.8-Max:2026-10-23"
  },
  {
    "id": "sc_text_mv_amazon__nova-2-lite_default_2026-10-22",
    "modelVersionId": "mv_amazon__nova-2-lite",
    "source": "arena_hf",
    "board": "text",
    "condition": "default",
    "rating": 1361.9426864726083,
    "ciLow": 1355.9354029516512,
    "ciHigh": 1367.949969993565,
    "rank": 197,
    "votes": 12410,
    "snapshotDate": "2026-10-22",
    "sourceRef": "arena_hf:text:Amazon Nova 2 Lite:2026-10-22"
  },
  {
    "id": "sc_text_mv_anthropic__claude-fable-5-1_max_2026-10-22",
    "modelVersionId": "mv_anthropic__claude-fable-5-1",
    "source": "arena_hf",
    "board": "text",
    "condition": "Max",
    "rating": 1512.546971666733,
    "ciLow": 1506.6860477335913,
    "ciHigh": 1518.4078955998748,
    "rank": 3,
    "votes": 16343,
    "snapshotDate": "2026-10-22",
    "sourceRef": "arena_hf:text:Claude Fable 5.1 (Max):2026-10-22"
  },
  {
    "id": "sc_webdev_mv_anthropic__claude-fable-5-1_max_2026-10-23",
    "modelVersionId": "mv_anthropic__claude-fable-5-1",
    "source": "arena_hf",
    "board": "webdev",
    "condition": "Max",
    "rating": 1742.454511159061,
    "ciLow": 1733.70537253876,
    "ciHigh": 1751.2036497793615,
    "rank": 5,
    "votes": 8098,
    "snapshotDate": "2026-10-23",
    "sourceRef": "arena_hf:webdev:Claude Fable 5.1 (Max):2026-10-23"
  },
  {
    "id": "sc_text_mv_anthropic__claude-haiku-5-5_high_2026-10-22",
    "modelVersionId": "mv_anthropic__claude-haiku-5-5",
    "source": "arena_hf",
    "board": "text",
    "condition": "High",
    "rating": 1400.623743347211,
    "ciLow": 1392.3264675511505,
    "ciHigh": 1408.9210191432717,
    "rank": 153,
    "votes": 6080,
    "snapshotDate": "2026-10-22",
    "sourceRef": "arena_hf:text:Claude Haiku 5.5 (High):2026-10-22"
  },
  {
    "id": "sc_webdev_mv_anthropic__claude-haiku-5-5_high_2026-10-23",
    "modelVersionId": "mv_anthropic__claude-haiku-5-5",
    "source": "arena_hf",
    "board": "webdev",
    "condition": "High",
    "rating": 1585.637687443752,
    "ciLow": 1575.198093853182,
    "ciHigh": 1596.0772810343215,
    "rank": 35,
    "votes": 3917,
    "snapshotDate": "2026-10-23",
    "sourceRef": "arena_hf:webdev:Claude Haiku 5.5 (High):2026-10-23"
  },
  {
    "id": "sc_text_mv_anthropic__claude-opus-5-5_high_2026-10-22",
    "modelVersionId": "mv_anthropic__claude-opus-5-5",
    "source": "arena_hf",
    "board": "text",
    "condition": "High",
    "rating": 1516.16649584179,
    "ciLow": 1509.3746542533136,
    "ciHigh": 1522.958337430266,
    "rank": 2,
    "votes": 10322,
    "snapshotDate": "2026-10-22",
    "sourceRef": "arena_hf:text:Claude Opus 5.5 (High):2026-10-22"
  },
  {
    "id": "sc_webdev_mv_anthropic__claude-opus-5-5_max_2026-10-23",
    "modelVersionId": "mv_anthropic__claude-opus-5-5",
    "source": "arena_hf",
    "board": "webdev",
    "condition": "Max",
    "rating": 1806.9194673086658,
    "ciLow": 1793.5573888805984,
    "ciHigh": 1820.2815457367337,
    "rank": 1,
    "votes": 3140,
    "snapshotDate": "2026-10-23",
    "sourceRef": "arena_hf:webdev:Claude Opus 5.5 (Max):2026-10-23"
  },
  {
    "id": "sc_text_mv_anthropic__claude-sonnet-5-5_xhigh_2026-10-22",
    "modelVersionId": "mv_anthropic__claude-sonnet-5-5",
    "source": "arena_hf",
    "board": "text",
    "condition": "xHigh",
    "rating": 1473.0623301030796,
    "ciLow": 1466.0613395066566,
    "ciHigh": 1480.0633206995021,
    "rank": 28,
    "votes": 8977,
    "snapshotDate": "2026-10-22",
    "sourceRef": "arena_hf:text:Claude Sonnet 5.5 (xHigh):2026-10-22"
  },
  {
    "id": "sc_webdev_mv_anthropic__claude-sonnet-5-5_xhigh_2026-10-23",
    "modelVersionId": "mv_anthropic__claude-sonnet-5-5",
    "source": "arena_hf",
    "board": "webdev",
    "condition": "xHigh",
    "rating": 1768.9190226748196,
    "ciLow": 1756.7371060296073,
    "ciHigh": 1781.100939320032,
    "rank": 3,
    "votes": 3822,
    "snapshotDate": "2026-10-23",
    "sourceRef": "arena_hf:webdev:Claude Sonnet 5.5 (xHigh):2026-10-23"
  },
  {
    "id": "sc_webdev_mv_anthropic__claude-sonnet-5-5_high_2026-10-23",
    "modelVersionId": "mv_anthropic__claude-sonnet-5-5",
    "source": "arena_hf",
    "board": "webdev",
    "condition": "High",
    "rating": 1709.231500483586,
    "ciLow": 1699.6199740268285,
    "ciHigh": 1718.8430269403434,
    "rank": 7,
    "votes": 5632,
    "snapshotDate": "2026-10-23",
    "sourceRef": "arena_hf:webdev:Claude Sonnet 5.5 (High):2026-10-23"
  },
  {
    "id": "sc_text_mv_deepseek__deepseek-v4-pro-0813_high-20260813_2026-10-22",
    "modelVersionId": "mv_deepseek__deepseek-v4-pro-0813",
    "source": "arena_hf",
    "board": "text",
    "condition": "High, 20260813",
    "rating": 1445.5827574281452,
    "ciLow": 1439.0163543886333,
    "ciHigh": 1452.149160467657,
    "rank": 60,
    "votes": 9797,
    "snapshotDate": "2026-10-22",
    "sourceRef": "arena_hf:text:DeepSeek-V4-Pro (High, 20260813):2026-10-22"
  },
  {
    "id": "sc_webdev_mv_deepseek__deepseek-v4-pro-0813_high-20260813_2026-10-23",
    "modelVersionId": "mv_deepseek__deepseek-v4-pro-0813",
    "source": "arena_hf",
    "board": "webdev",
    "condition": "High, 20260813",
    "rating": 1582.2610955444684,
    "ciLow": 1572.7969097554883,
    "ciHigh": 1591.7252813334485,
    "rank": 37,
    "votes": 4714,
    "snapshotDate": "2026-10-23",
    "sourceRef": "arena_hf:webdev:DeepSeek-V4-Pro (High, 20260813):2026-10-23"
  },
  {
    "id": "sc_webdev_mv_deepseek__deepseek-v4.1-flash-1017_max_2026-10-23",
    "modelVersionId": "mv_deepseek__deepseek-v4.1-flash-1017",
    "source": "arena_hf",
    "board": "webdev",
    "condition": "Max",
    "rating": 1664.9514302499974,
    "ciLow": 1651.9355321924513,
    "ciHigh": 1677.967328307543,
    "rank": 14,
    "votes": 2500,
    "snapshotDate": "2026-10-23",
    "sourceRef": "arena_hf:webdev:DeepSeek-V4.1-Flash-20261017 (Max):2026-10-23"
  },
  {
    "id": "sc_text_mv_google__gemini-3.1-pro-preview-customtools_default_2026-10-22",
    "modelVersionId": "mv_google__gemini-3.1-pro-preview-customtools",
    "source": "arena_hf",
    "board": "text",
    "condition": "default",
    "rating": 1480.2323298033084,
    "ciLow": 1477.311750149252,
    "ciHigh": 1483.1529094573643,
    "rank": 19,
    "votes": 130819,
    "snapshotDate": "2026-10-22",
    "sourceRef": "arena_hf:text:Gemini 3.1 Pro Preview:2026-10-22"
  },
  {
    "id": "sc_webdev_mv_google__gemini-3.1-pro-preview-customtools_default_2026-10-23",
    "modelVersionId": "mv_google__gemini-3.1-pro-preview-customtools",
    "source": "arena_hf",
    "board": "webdev",
    "condition": "default",
    "rating": 1446.679075371661,
    "ciLow": 1441.6226861757705,
    "ciHigh": 1451.7354645675514,
    "rank": 78,
    "votes": 24232,
    "snapshotDate": "2026-10-23",
    "sourceRef": "arena_hf:webdev:Gemini 3.1 Pro Preview:2026-10-23"
  },
  {
    "id": "sc_text_mv_google__gemini-3.5-flash-lite_default_2026-10-22",
    "modelVersionId": "mv_google__gemini-3.5-flash-lite",
    "source": "arena_hf",
    "board": "text",
    "condition": "default",
    "rating": 1434.974400016607,
    "ciLow": 1430.5187979504012,
    "ciHigh": 1439.4300020828127,
    "rank": 88,
    "votes": 35829,
    "snapshotDate": "2026-10-22",
    "sourceRef": "arena_hf:text:Gemini 3.5 Flash-Lite:2026-10-22"
  },
  {
    "id": "sc_webdev_mv_google__gemini-3.5-flash-lite_default_2026-10-23",
    "modelVersionId": "mv_google__gemini-3.5-flash-lite",
    "source": "arena_hf",
    "board": "webdev",
    "condition": "default",
    "rating": 1433.9418850101824,
    "ciLow": 1392.9612125720168,
    "ciHigh": 1474.922557448348,
    "rank": 87,
    "votes": 237,
    "snapshotDate": "2026-10-23",
    "sourceRef": "arena_hf:webdev:Gemini 3.5 Flash-Lite:2026-10-23"
  },
  {
    "id": "sc_text_mv_google__gemini-3.8-flash_high_2026-10-22",
    "modelVersionId": "mv_google__gemini-3.8-flash",
    "source": "arena_hf",
    "board": "text",
    "condition": "High",
    "rating": 1498.2982753281758,
    "ciLow": 1493.8318892268112,
    "ciHigh": 1502.76466142954,
    "rank": 8,
    "votes": 43997,
    "snapshotDate": "2026-10-22",
    "sourceRef": "arena_hf:text:Gemini 3.8 Flash (High):2026-10-22"
  },
  {
    "id": "sc_webdev_mv_google__gemini-3.8-flash_high_2026-10-23",
    "modelVersionId": "mv_google__gemini-3.8-flash",